{
  "$schema": "./hygienenote-gingival-ioe.schema.json",
  "schemaVersion": "1.1.0",
  "catalogId": "hygienenote.gingival-and-ioe",
  "title": "HygieneNote Gingival Description and Intraoral Examination",
  "source": {
    "documentName": "DH Note.docx",
    "sourcePages": [2, 3, 4],
    "excludedFromImplementation": ["chief_concerns"],
    "exclusionReason": "Chief Concern was already implemented before this specification.",
    "sourceTables": [
      {
        "tableId": "gingival_description",
        "sourceTableNumber": 1,
        "headers": [
          "Descriptor",
          "Normal Findings",
          "Abnormal Findings",
          "Normal Clinical Notes",
          "Abnormal Clinical Notes"
        ],
        "rows": [
          {
            "rowId": "color",
            "sourceRowNumber": 2,
            "cells": {
              "Descriptor": "Color",
              "Normal Findings": "Coral pink, with slight pigmentation in some ethnicities.",
              "Abnormal Findings": "Red, bright red, bluish-red, pale pink, or white patches.",
              "Normal Clinical Notes": "Gingiva appears coral pink with no erythema or discoloration.",
              "Abnormal Clinical Notes": "Gingiva exhibits generalized redness in the anterior maxilla, indicative of inflammation. A localized bluish tint on the gingiva of #24–25 suggests cyanosis."
            }
          },
          {
            "rowId": "contour_shape",
            "sourceRowNumber": 3,
            "cells": {
              "Descriptor": "Contour / Shape",
              "Normal Findings": "Knife-edged margins, flat against the teeth. Papillae fill embrasures.",
              "Abnormal Findings": "Rounded, rolled, or bulbous margins; blunted, cratered, or enlarged papillae.",
              "Normal Clinical Notes": "Gingival margins are knife-edged and flat against the teeth. Papillae completely fill the embrasures.",
              "Abnormal Clinical Notes": "Gingival margins around #7–10 are rolled and rounded. Papillae between #8–9 are blunted."
            }
          },
          {
            "rowId": "consistency",
            "sourceRowNumber": 4,
            "cells": {
              "Descriptor": "Consistency",
              "Normal Findings": "Firm and resilient when palpated.",
              "Abnormal Findings": "Soft, spongy, or fibrotic; easily displaced with air or probing.",
              "Normal Clinical Notes": "Gingiva is firm and resilient to palpation, with no areas of softness detected.",
              "Abnormal Clinical Notes": "Gingiva is soft and spongy in the posterior sextants. Tissue compresses easily with air, and slight edema is present in the #18–19 region."
            }
          },
          {
            "rowId": "surface_texture",
            "sourceRowNumber": 5,
            "cells": {
              "Descriptor": "Surface / Texture",
              "Normal Findings": "Stippled appearance on attached gingiva; smooth on marginal gingiva.",
              "Abnormal Findings": "Smooth, shiny, or excessively stippled (fibrotic).",
              "Normal Clinical Notes": "Attached gingiva displays appropriate stippling; marginal gingiva is smooth and intact.",
              "Abnormal Clinical Notes": "Gingiva in the mandibular anterior region appears smooth and shiny with loss of stippling. A localized fibrotic texture is noted in the #2–3 area."
            }
          },
          {
            "rowId": "position_size",
            "sourceRowNumber": 6,
            "cells": {
              "Descriptor": "Position / Size",
              "Normal Findings": "At or slightly below the CEJ, covering the root in younger patients.",
              "Abnormal Findings": "Receded (root exposure), or enlarged/overgrown tissue.",
              "Normal Clinical Notes": "Gingival margins are at or slightly below the CEJ with no recession or overgrowth noted.",
              "Abnormal Clinical Notes": "Localized gingival recession of 3 mm is noted on #6–7 with root exposure. Generalized gingival overgrowth is present in the maxillary posterior region."
            }
          }
        ]
      },
      {
        "tableId": "ioe",
        "sourceTableNumber": 2,
        "headers": [
          "Structure",
          "Normal Findings",
          "Abnormal Findings",
          "Common Variations",
          "Example Clinical Documentation"
        ],
        "rows": [
          {
            "rowId": "buccal_mucosa",
            "sourceRowNumber": 2,
            "cells": {
              "Structure": "Buccal Mucosa",
              "Normal Findings": "Pink, moist, no lesions or swelling",
              "Abnormal Findings": "Ulcers, white/red patches, swelling",
              "Common Variations": "Fordyce granules, linea alba",
              "Example Clinical Documentation": "Buccal mucosa: Pink, moist, and intact bilaterally. Linea alba observed on the right side, consistent with the patient's occlusion history. No pathology detected."
            }
          },
          {
            "rowId": "gingiva",
            "sourceRowNumber": 3,
            "cells": {
              "Structure": "Gingiva",
              "Normal Findings": "Coral pink, firm, knife-edged margins, no bleeding",
              "Abnormal Findings": "Red, swollen, receding, bleeding",
              "Common Variations": "Slight redness (mild gingivitis)",
              "Example Clinical Documentation": "Gingiva: Generalized coral pink with localized redness in the posterior mandible. Bleeding noted upon probing in areas #30–31. Patient advised on oral hygiene improvements."
            }
          },
          {
            "rowId": "tongue",
            "sourceRowNumber": 4,
            "cells": {
              "Structure": "Tongue",
              "Normal Findings": "Pink, moist, symmetrical, no lesions",
              "Abnormal Findings": "Coated, fissured, swollen, lesions",
              "Common Variations": "Scalloped edges, geographic tongue",
              "Example Clinical Documentation": "Tongue: Pink, moist, and symmetrical. Scalloping noted on the lateral borders, likely due to tongue thrust or parafunctional habits. Patient denies pain or discomfort."
            }
          },
          {
            "rowId": "floor_of_mouth",
            "sourceRowNumber": 5,
            "cells": {
              "Structure": "Floor of Mouth",
              "Normal Findings": "Pink, smooth, no swelling or discoloration",
              "Abnormal Findings": "Swelling, masses, blue/black discoloration",
              "Common Variations": "Prominent lingual veins",
              "Example Clinical Documentation": "Floor of mouth: Pink, smooth, and intact. Prominent veins observed bilaterally. No abnormalities noted."
            }
          },
          {
            "rowId": "palate_hard_soft",
            "sourceRowNumber": 6,
            "cells": {
              "Structure": "Palate (Hard/Soft)",
              "Normal Findings": "Pink, intact, no lesions or abnormal growths",
              "Abnormal Findings": "Ulcers, red/white patches, petechiae",
              "Common Variations": "Torus palatinus",
              "Example Clinical Documentation": "Palate: Torus palatinus observed on the midline of the hard palate. Mucosa pink and intact. No lesions or tenderness reported."
            }
          },
          {
            "rowId": "oropharynx",
            "sourceRowNumber": 7,
            "cells": {
              "Structure": "Oropharynx",
              "Normal Findings": "Uvula midline, no redness, swelling, or exudate",
              "Abnormal Findings": "Redness, swelling, asymmetry, exudate",
              "Common Variations": "Enlarged tonsils without exudate",
              "Example Clinical Documentation": "Oropharynx: Uvula midline. No swelling or exudate noted. Tonsils slightly enlarged but symmetrical. No complaints of pain or difficulty swallowing."
            }
          },
          {
            "rowId": "teeth",
            "sourceRowNumber": 8,
            "cells": {
              "Structure": "Teeth",
              "Normal Findings": "Intact, no caries, no mobility",
              "Abnormal Findings": "Caries, fractures, discoloration, mobility",
              "Common Variations": "Enamel hypoplasia, fluorosis",
              "Example Clinical Documentation": "Teeth: Caries noted on #18 (MOD) and #30 (DO). Slight discoloration present on anterior teeth due to mild fluorosis. Patient educated on restorative treatment options."
            }
          },
          {
            "rowId": "occlusion",
            "sourceRowNumber": 9,
            "cells": {
              "Structure": "Occlusion",
              "Normal Findings": "Class I (normal bite)",
              "Abnormal Findings": "Class II or III, open bite, crossbite, increased overjet/overbite",
              "Common Variations": "Slight malocclusion",
              "Example Clinical Documentation": "Occlusion: Class II Division 1 observed. Overjet measured at 5 mm. Patient advised on potential orthodontic options for correction if desired."
            }
          },
          {
            "rowId": "saliva",
            "sourceRowNumber": 10,
            "cells": {
              "Structure": "Saliva",
              "Normal Findings": "Clear, normal flow",
              "Abnormal Findings": "Thick, sticky, reduced flow",
              "Common Variations": "Slightly viscous saliva",
              "Example Clinical Documentation": "Saliva: Clear with adequate flow noted. Patient denies symptoms of dry mouth. Re-evaluate at the next visit for signs of potential xerostomia."
            }
          }
        ]
      }
    ]
  },
  "implementationPolicies": {
    "sourceOfTruth": "normalizedSections",
    "rawSourceTablesAreAuditOnly": true,
    "canonicalFixedSelectionValue": "stable_option_id",
    "generatedTextIsNotCanonicalSelectionValue": true,
    "defaultAssessmentStatus": "not_assessed",